{"$schema":"http://json-schema.org/draft-07/schema#","title":"Vell AST","type":"object","required":["version","children","metadata","span"],"properties":{"version":{"const":1},"children":{"type":"array","items":{"$ref":"#/$defs/Node"}},"metadata":{"type":"object"},"span":{"$ref":"#/$defs/Span"}},"$defs":{"Span":{"type":"object","required":["start","end"],"properties":{"start":{"type":"integer","minimum":0},"end":{"type":"integer","minimum":0}}},"Node":{"type":"object","required":["type","span"],"properties":{"type":{"type":"string"},"span":{"$ref":"#/$defs/Span"}},"additionalProperties":true},"InlineNode":{"type":"object","required":["type","span"],"properties":{"type":{"type":"string"},"span":{"$ref":"#/$defs/Span"}},"additionalProperties":true}}}
