{
  "version": 1,
  "children": [
    {
      "type": "Paragraph",
      "children": [
        {
          "type": "LinkRef",
          "id": "ref",
          "children": [
            {
              "type": "Text",
              "value": "text",
              "span": {
                "start": 1,
                "end": 5
              }
            }
          ],
          "span": {
            "start": 0,
            "end": 11
          }
        },
        {
          "type": "Text",
          "value": "\n",
          "span": {
            "start": 11,
            "end": 12
          }
        },
        {
          "type": "LinkRef",
          "id": "",
          "children": [
            {
              "type": "Text",
              "value": "text",
              "span": {
                "start": 13,
                "end": 17
              }
            }
          ],
          "span": {
            "start": 12,
            "end": 20
          }
        }
      ],
      "span": {
        "start": 0,
        "end": 23
      }
    }
  ],
  "metadata": {
    "title": null,
    "author": null,
    "date": null,
    "lang": null,
    "variables": {}
  },
  "span": {
    "start": 0,
    "end": 23
  }
}
