{
  "version": 1,
  "children": [
    {
      "type": "Table",
      "headers": [
        {
          "children": [
            {
              "type": "Text",
              "value": "A",
              "span": {
                "start": 12,
                "end": 13
              }
            }
          ],
          "colspan": 1,
          "rowspan": 1,
          "align": null,
          "span": {
            "start": 11,
            "end": 16
          }
        },
        {
          "children": [
            {
              "type": "Text",
              "value": "B",
              "span": {
                "start": 16,
                "end": 17
              }
            }
          ],
          "colspan": 1,
          "rowspan": 1,
          "align": null,
          "span": {
            "start": 15,
            "end": 20
          }
        }
      ],
      "rows": [
        [
          {
            "children": [
              {
                "type": "Text",
                "value": "1",
                "span": {
                  "start": 34,
                  "end": 35
                }
              }
            ],
            "colspan": 1,
            "rowspan": 1,
            "align": null,
            "span": {
              "start": 33,
              "end": 38
            }
          },
          {
            "children": [
              {
                "type": "Text",
                "value": "2",
                "span": {
                  "start": 38,
                  "end": 39
                }
              }
            ],
            "colspan": 1,
            "rowspan": 1,
            "align": null,
            "span": {
              "start": 37,
              "end": 42
            }
          }
        ]
      ],
      "span": {
        "start": 0,
        "end": 55
      }
    }
  ],
  "metadata": {
    "title": null,
    "author": null,
    "date": null,
    "lang": null,
    "variables": {}
  },
  "span": {
    "start": 0,
    "end": 55
  }
}