{
  "version": 1,
  "children": [
    {
      "type": "CodeBlock",
      "lang": null,
      "source": "code without lang",
      "executable": false,
      "span": {
        "start": 0,
        "end": 26
      }
    }
  ],
  "metadata": {
    "title": null,
    "author": null,
    "date": null,
    "lang": null,
    "variables": {}
  },
  "span": {
    "start": 0,
    "end": 26
  }
}
