{
  "version": 1,
  "children": [
    {
      "type": "Paragraph",
      "children": [
        {
          "type": "Text",
          "value": "*",
          "span": {
            "start": 0,
            "end": 2
          }
        },
        {
          "type": "Text",
          "value": " safe",
          "span": {
            "start": 2,
            "end": 7
          }
        }
      ],
      "span": {
        "start": 0,
        "end": 8
      }
    },
    {
      "type": "Paragraph",
      "children": [
        {
          "type": "Text",
          "value": "/",
          "span": {
            "start": 9,
            "end": 11
          }
        },
        {
          "type": "Text",
          "value": " safe",
          "span": {
            "start": 11,
            "end": 16
          }
        }
      ],
      "span": {
        "start": 9,
        "end": 17
      }
    },
    {
      "type": "Paragraph",
      "children": [
        {
          "type": "Text",
          "value": "_",
          "span": {
            "start": 18,
            "end": 20
          }
        },
        {
          "type": "Text",
          "value": " safe",
          "span": {
            "start": 20,
            "end": 25
          }
        }
      ],
      "span": {
        "start": 18,
        "end": 26
      }
    },
    {
      "type": "Paragraph",
      "children": [
        {
          "type": "Text",
          "value": "~",
          "span": {
            "start": 27,
            "end": 29
          }
        },
        {
          "type": "Text",
          "value": " safe",
          "span": {
            "start": 29,
            "end": 34
          }
        }
      ],
      "span": {
        "start": 27,
        "end": 35
      }
    },
    {
      "type": "Paragraph",
      "children": [
        {
          "type": "Text",
          "value": "`",
          "span": {
            "start": 36,
            "end": 38
          }
        },
        {
          "type": "Text",
          "value": " safe",
          "span": {
            "start": 38,
            "end": 43
          }
        }
      ],
      "span": {
        "start": 36,
        "end": 44
      }
    },
    {
      "type": "Paragraph",
      "children": [
        {
          "type": "Text",
          "value": "$",
          "span": {
            "start": 45,
            "end": 47
          }
        },
        {
          "type": "Text",
          "value": " safe",
          "span": {
            "start": 47,
            "end": 52
          }
        }
      ],
      "span": {
        "start": 45,
        "end": 53
      }
    },
    {
      "type": "Paragraph",
      "children": [
        {
          "type": "Text",
          "value": "\\",
          "span": {
            "start": 54,
            "end": 56
          }
        },
        {
          "type": "Text",
          "value": " safe",
          "span": {
            "start": 56,
            "end": 61
          }
        }
      ],
      "span": {
        "start": 54,
        "end": 62
      }
    }
  ],
  "metadata": {
    "title": null,
    "author": null,
    "date": null,
    "lang": null,
    "variables": {}
  },
  "span": {
    "start": 0,
    "end": 62
  }
}
