{
  "version": 1,
  "children": [
    {
      "type": "Heading",
      "level": 1,
      "children": [
        {
          "type": "Text",
          "value": "Full",
          "span": {
            "start": 2,
            "end": 6
          }
        }
      ],
      "id": "full",
      "span": {
        "start": 0,
        "end": 8
      }
    },
    {
      "type": "VarDeclaration",
      "name": "count",
      "value": 1,
      "span": {
        "start": 10,
        "end": 26
      }
    },
    {
      "type": "Paragraph",
      "children": [
        {
          "type": "Text",
          "value": "Text ",
          "span": {
            "start": 28,
            "end": 33
          }
        },
        {
          "type": "VarInterpolation",
          "name": "count",
          "span": {
            "start": 33,
            "end": 41
          }
        },
        {
          "type": "Text",
          "value": ".",
          "span": {
            "start": 41,
            "end": 42
          }
        }
      ],
      "span": {
        "start": 28,
        "end": 44
      }
    }
  ],
  "metadata": {
    "title": "Full",
    "author": null,
    "date": null,
    "lang": null,
    "variables": {
      "count": 1
    }
  },
  "span": {
    "start": 0,
    "end": 44
  }
}