{
  "version": 1,
  "children": [
    {
      "type": "Directive",
      "name": "Figure",
      "props": {
        "alt": "A",
        "caption": "Caption",
        "src": "a.png"
      },
      "children": [],
      "span": {
        "start": 0,
        "end": 50
      }
    }
  ],
  "metadata": {
    "title": null,
    "author": null,
    "date": null,
    "lang": null,
    "variables": {}
  },
  "span": {
    "start": 0,
    "end": 50
  }
}