{
  "version": 1,
  "children": [
    {
      "type": "Extension",
      "name": "",
      "props": {
        "key": "value"
      },
      "children": [],
      "raw_source": "@[](key=\"value\")",
      "span": {
        "start": 0,
        "end": 18
      }
    }
  ],
  "metadata": {
    "title": null,
    "author": null,
    "date": null,
    "lang": null,
    "variables": {}
  },
  "span": {
    "start": 0,
    "end": 18
  }
}
