{
  "version": 1,
  "children": [
    {
      "type": "List",
      "ordered": false,
      "start": null,
      "items": [
        {
          "children": [
            {
              "type": "Paragraph",
              "children": [
                {
                  "type": "Text",
                  "value": "Outer",
                  "span": {
                    "start": 0,
                    "end": 5
                  }
                }
              ],
              "span": {
                "start": 0,
                "end": 8
              }
            }
          ],
          "checked": null,
          "span": {
            "start": 0,
            "end": 8
          }
        },
        {
          "children": [
            {
              "type": "Paragraph",
              "children": [
                {
                  "type": "Text",
                  "value": "Inner",
                  "span": {
                    "start": 8,
                    "end": 13
                  }
                }
              ],
              "span": {
                "start": 8,
                "end": 16
              }
            }
          ],
          "checked": null,
          "span": {
            "start": 8,
            "end": 16
          }
        },
        {
          "children": [
            {
              "type": "Paragraph",
              "children": [
                {
                  "type": "Text",
                  "value": "Another",
                  "span": {
                    "start": 16,
                    "end": 23
                  }
                }
              ],
              "span": {
                "start": 16,
                "end": 26
              }
            }
          ],
          "checked": null,
          "span": {
            "start": 16,
            "end": 26
          }
        }
      ],
      "span": {
        "start": 0,
        "end": 26
      }
    }
  ],
  "metadata": {
    "title": null,
    "author": null,
    "date": null,
    "lang": null,
    "variables": {}
  },
  "span": {
    "start": 0,
    "end": 26
  }
}
