{
  "version": 1,
  "children": [
    {
      "type": "IfBlock",
      "condition": "true",
      "consequent": [
        {
          "type": "Paragraph",
          "children": [
            {
              "type": "Text",
              "value": "A",
              "span": {
                "start": 0,
                "end": 1
              }
            }
          ],
          "span": {
            "start": 0,
            "end": 2
          }
        }
      ],
      "alternate": [
        {
          "type": "Paragraph",
          "children": [
            {
              "type": "Text",
              "value": "B",
              "span": {
                "start": 0,
                "end": 1
              }
            }
          ],
          "span": {
            "start": 0,
            "end": 2
          }
        }
      ],
      "span": {
        "start": 0,
        "end": 30
      }
    },
    {
      "type": "IfBlock",
      "condition": "false",
      "consequent": [
        {
          "type": "Paragraph",
          "children": [
            {
              "type": "Text",
              "value": "X",
              "span": {
                "start": 0,
                "end": 1
              }
            }
          ],
          "span": {
            "start": 0,
            "end": 2
          }
        }
      ],
      "alternate": null,
      "span": {
        "start": 31,
        "end": 49
      }
    }
  ],
  "metadata": {
    "title": null,
    "author": null,
    "date": null,
    "lang": null,
    "variables": {}
  },
  "span": {
    "start": 0,
    "end": 49
  }
}
