{
  "version": 1,
  "children": [
    {
      "type": "DefinitionList",
      "items": [
        {
          "term": [
            {
              "type": "Text",
              "value": "term",
              "span": {
                "start": 0,
                "end": 4
              }
            }
          ],
          "definition": [],
          "span": {
            "start": 0,
            "end": 9
          }
        },
        {
          "term": [
            {
              "type": "Text",
              "value": "definition",
              "span": {
                "start": 9,
                "end": 19
              }
            }
          ],
          "definition": [],
          "span": {
            "start": 9,
            "end": 24
          }
        }
      ],
      "span": {
        "start": 0,
        "end": 0
      }
    }
  ],
  "metadata": {
    "title": null,
    "author": null,
    "date": null,
    "lang": null,
    "variables": {}
  },
  "span": {
    "start": 0,
    "end": 24
  }
}
