{
  "version": 1,
  "children": [
    {
      "type": "VarDeclaration",
      "name": "count",
      "value": 0,
      "span": {
        "start": 0,
        "end": 16
      }
    },
    {
      "type": "Paragraph",
      "children": [
        {
          "type": "Text",
          "value": "Count ",
          "span": {
            "start": 18,
            "end": 24
          }
        },
        {
          "type": "VarInterpolation",
          "name": "count",
          "span": {
            "start": 24,
            "end": 32
          }
        }
      ],
      "span": {
        "start": 18,
        "end": 34
      }
    }
  ],
  "metadata": {
    "title": null,
    "author": null,
    "date": null,
    "lang": null,
    "variables": {
      "count": 0
    }
  },
  "span": {
    "start": 0,
    "end": 34
  }
}