{
  "version": 1,
  "children": [
    {
      "type": "CodeBlock",
      "lang": "rust",
      "source": "fn main() {}",
      "executable": false,
      "span": {
        "start": 0,
        "end": 28
      }
    }
  ],
  "metadata": {
    "title": null,
    "author": null,
    "date": null,
    "lang": null,
    "variables": {}
  },
  "span": {
    "start": 0,
    "end": 28
  }
}