{
  "version": 1,
  "children": [
    {
      "type": "Paragraph",
      "children": [
        {
          "type": "Text",
          "value": "Inline ",
          "span": {
            "start": 0,
            "end": 7
          }
        },
        {
          "type": "Bold",
          "children": [
            {
              "type": "Text",
              "value": "bold",
              "span": {
                "start": 8,
                "end": 12
              }
            }
          ],
          "span": {
            "start": 7,
            "end": 13
          }
        },
        {
          "type": "Text",
          "value": " ",
          "span": {
            "start": 13,
            "end": 14
          }
        },
        {
          "type": "Italic",
          "children": [
            {
              "type": "Text",
              "value": "italic",
              "span": {
                "start": 15,
                "end": 21
              }
            }
          ],
          "span": {
            "start": 14,
            "end": 22
          }
        },
        {
          "type": "Text",
          "value": " ",
          "span": {
            "start": 22,
            "end": 23
          }
        },
        {
          "type": "Underline",
          "children": [
            {
              "type": "Text",
              "value": "under",
              "span": {
                "start": 24,
                "end": 29
              }
            }
          ],
          "span": {
            "start": 23,
            "end": 30
          }
        },
        {
          "type": "Text",
          "value": " ",
          "span": {
            "start": 30,
            "end": 31
          }
        },
        {
          "type": "Strikethrough",
          "children": [
            {
              "type": "Text",
              "value": "strike",
              "span": {
                "start": 32,
                "end": 38
              }
            }
          ],
          "span": {
            "start": 31,
            "end": 39
          }
        },
        {
          "type": "Text",
          "value": " ",
          "span": {
            "start": 39,
            "end": 40
          }
        },
        {
          "type": "Code",
          "value": "code",
          "span": {
            "start": 40,
            "end": 46
          }
        },
        {
          "type": "Text",
          "value": " ",
          "span": {
            "start": 46,
            "end": 47
          }
        },
        {
          "type": "MathInline",
          "source": "x",
          "span": {
            "start": 47,
            "end": 50
          }
        },
        {
          "type": "Text",
          "value": " ",
          "span": {
            "start": 50,
            "end": 51
          }
        },
        {
          "type": "VarInterpolation",
          "name": "missing",
          "span": {
            "start": 51,
            "end": 61
          }
        },
        {
          "type": "Text",
          "value": " ",
          "span": {
            "start": 61,
            "end": 62
          }
        },
        {
          "type": "Citation",
          "key": "key",
          "span": {
            "start": 62,
            "end": 69
          }
        },
        {
          "type": "Text",
          "value": " ",
          "span": {
            "start": 69,
            "end": 70
          }
        },
        {
          "type": "FootnoteRef",
          "marker": "n",
          "span": {
            "start": 70,
            "end": 74
          }
        },
        {
          "type": "Text",
          "value": ".",
          "span": {
            "start": 74,
            "end": 75
          }
        }
      ],
      "span": {
        "start": 0,
        "end": 77
      }
    }
  ],
  "metadata": {
    "title": null,
    "author": null,
    "date": null,
    "lang": null,
    "variables": {}
  },
  "span": {
    "start": 0,
    "end": 77
  }
}