{
  "version": 1,
  "children": [
    {
      "type": "ReferenceDefinition",
      "id": "ref1",
      "url": "https://example.com",
      "title": null,
      "span": {
        "start": 0,
        "end": 29
      }
    },
    {
      "type": "ReferenceDefinition",
      "id": "ref2",
      "url": "https://example.org",
      "title": "With Title",
      "span": {
        "start": 29,
        "end": 71
      }
    },
    {
      "type": "Paragraph",
      "children": [
        {
          "type": "Text",
          "value": "A link ref: ",
          "span": {
            "start": 71,
            "end": 83
          }
        },
        {
          "type": "LinkRef",
          "id": "ref1",
          "children": [
            {
              "type": "Text",
              "value": "see this",
              "span": {
                "start": 84,
                "end": 92
              }
            }
          ],
          "span": {
            "start": 83,
            "end": 99
          }
        }
      ],
      "span": {
        "start": 71,
        "end": 101
      }
    }
  ],
  "metadata": {
    "title": null,
    "author": null,
    "date": null,
    "lang": null,
    "variables": {}
  },
  "span": {
    "start": 0,
    "end": 101
  }
}
